rating_key,title,parent_title,grandparent_title,full_title,parent_media_index,media_index,media_type,studio,started,stopped,seconds,start_time,end_time
16061,Request x And x Wish,Season 1,Hunter x Hunter (2011),Hunter x Hunter (2011) - Request x And x Wish,1,138,episode,NTV (JP),1599101390,1599104238,2848,9/2/20 22:49,9/2/20 23:37
16062,Alluka x And x Something,Season 1,Hunter x Hunter (2011),Hunter x Hunter (2011) - Alluka x And x Something,1,139,episode,NTV (JP),1599104486,1599105234,748,9/2/20 23:41,9/2/20 23:53
16063,Joining the Fray x And x Open Hostilities,Season 1,Hunter x Hunter (2011),Hunter x Hunter (2011) - Joining the Fray x And x Open Hostilities,1,140,episode,NTV (JP),1599105821,1599107107,1286,9/3/20 0:03,9/3/20 0:25
16064,Magician x And x Butler,Season 1,Hunter x Hunter (2011),Hunter x Hunter (2011) - Magician x And x Butler,1,141,episode,NTV (JP),1599107110,1599108399,1289,9/3/20 0:25,9/3/20 0:46
16065,Needles x And x Debt,Season 1,Hunter x Hunter (2011),Hunter x Hunter (2011) - Needles x And x Debt,1,142,episode,NTV (JP),1599108401,1599109753,1352,9/3/20 0:46,9/3/20 1:09
16066,Sin x And x Claw,Season 1,Hunter x Hunter (2011),Hunter x Hunter (2011) - Sin x And x Claw,1,143,episode,NTV (JP),1599165387,1599167060,1673,9/3/20 16:36,9/3/20 17:04
16067,Approval x And x Coalition,Season 1,Hunter x Hunter (2011),Hunter x Hunter (2011) - Approval x And x Coalition,1,144,episode,NTV (JP),1599167073,1599168616,1543,9/3/20 17:04,9/3/20 17:30
16068,Defeat x And x Reunion,Season 1,Hunter x Hunter (2011),Hunter x Hunter (2011) - Defeat x And x Reunion,1,145,episode,NTV (JP),1599182560,1599182915,355,9/3/20 21:22,9/3/20 21:28
16069,Chairman x And x Release,Season 1,Hunter x Hunter (2011),Hunter x Hunter (2011) - Chairman x And x Release,1,146,episode,NTV (JP),1599183887,1599184837,950,9/3/20 21:44,9/3/20 22:00
16070,Salvation x And x Future,Season 1,Hunter x Hunter (2011),Hunter x Hunter (2011) - Salvation x And x Future,1,147,episode,NTV (JP),1599189427,1599190990,1563,9/3/20 23:17,9/3/20 23:43
16071,Past x And x Future,Season 1,Hunter x Hunter (2011),Hunter x Hunter (2011) - Past x And x Future,1,148,episode,NTV (JP),1599191114,1599192871,1757,9/3/20 23:45,9/4/20 0:14