rating_key,title,parent_title,grandparent_title,full_title,parent_media_index,media_index,media_type,studio,started,stopped,seconds,start_time,end_time
10962,Departure x And x Friends,Season 1,Hunter x Hunter (2011),Hunter x Hunter (2011) - Departure x And x Friends,1,1,episode,Madhouse,1588215714,1588215935,221,4/29/20 23:01,4/29/20 23:05
10963,Test x Of x Tests,Season 1,Hunter x Hunter (2011),Hunter x Hunter (2011) - Test x Of x Tests,1,2,episode,NTV (JP),1588314924,1588316053,1129,5/1/20 2:35,5/1/20 2:54
10964,Rivals x In x Survival,Season 1,Hunter x Hunter (2011),Hunter x Hunter (2011) - Rivals x In x Survival,1,3,episode,NTV (JP),1588316558,1588316972,414,5/1/20 3:02,5/1/20 3:09
10965,Hope x And x Ambition,Season 1,Hunter x Hunter (2011),Hunter x Hunter (2011) - Hope x And x Ambition,1,4,episode,NTV (JP),1588318120,1588319686,1566,5/1/20 3:28,5/1/20 3:54
10966,Hisoka x is x Sneaky,Season 1,Hunter x Hunter (2011),Hunter x Hunter (2011) - Hisoka x is x Sneaky,1,5,episode,NTV (JP),1588319697,1588320952,1255,5/1/20 3:54,5/1/20 4:15
10967,A x Surprising x Challenge,Season 1,Hunter x Hunter (2011),Hunter x Hunter (2011) - A x Surprising x Challenge,1,6,episode,NTV (JP),1588395142,1588396463,1321,5/2/20 0:52,5/2/20 1:14
10968,Showdown x On x The Airship,Season 1,Hunter x Hunter (2011),Hunter x Hunter (2011) - Showdown x On x The Airship,1,7,episode,NTV (JP),1588396465,1588397761,1296,5/2/20 1:14,5/2/20 1:36
10969,Decision x By x Majority Rule?,Season 1,Hunter x Hunter (2011),Hunter x Hunter (2011) - Decision x By x Majority Rule?,1,8,episode,NTV (JP),1588397766,1588399026,1260,5/2/20 1:36,5/2/20 1:57
10970,Beware x Of x Prisoners,Season 1,Hunter x Hunter (2011),Hunter x Hunter (2011) - Beware x Of x Prisoners,1,9,episode,NTV (JP),1588399030,1588399527,497,5/2/20 1:57,5/2/20 2:05
10971,Trick x To x The Trick,Season 1,Hunter x Hunter (2011),Hunter x Hunter (2011) - Trick x To x The Trick,1,10,episode,NTV (JP),1588400300,1588401613,1313,5/2/20 2:18,5/2/20 2:40
10972,Trouble x With x The Gamble,Season 1,Hunter x Hunter (2011),Hunter x Hunter (2011) - Trouble x With x The Gamble,1,11,episode,NTV (JP),1588401649,1588401864,215,5/2/20 2:40,5/2/20 2:44
10973,Final x Test Of x Resolve,Season 1,Hunter x Hunter (2011),Hunter x Hunter (2011) - Final x Test Of x Resolve,1,12,episode,NTV (JP),1588402935,1588404146,1211,5/2/20 3:02,5/2/20 3:22
10974,Letter x From x Gon,Season 1,Hunter x Hunter (2011),Hunter x Hunter (2011) - Letter x From x Gon,1,13,episode,NTV (JP),1588433240,1588434316,1076,5/2/20 11:27,5/2/20 11:45
10975,Hit x the x Target,Season 1,Hunter x Hunter (2011),Hunter x Hunter (2011) - Hit x the x Target,1,14,episode,NTV (JP),1588434327,1588435597,1270,5/2/20 11:45,5/2/20 12:06
10976,Explosion x Of x Deception,Season 1,Hunter x Hunter (2011),Hunter x Hunter (2011) - Explosion x Of x Deception,1,15,episode,NTV (JP),1588541057,1588542342,1285,5/3/20 17:24,5/3/20 17:45
10977,Defeat x And x Disgrace,Season 1,Hunter x Hunter (2011),Hunter x Hunter (2011) - Defeat x And x Disgrace,1,16,episode,NTV (JP),1588619406,1588620363,957,5/4/20 15:10,5/4/20 15:26
10978,Trap x In x The Hole,Season 1,Hunter x Hunter (2011),Hunter x Hunter (2011) - Trap x In x The Hole,1,17,episode,NTV (JP),1588621671,1588621836,165,5/4/20 15:47,5/4/20 15:50
10979,Big x Time x Interview,Season 1,Hunter x Hunter (2011),Hunter x Hunter (2011) - Big x Time x Interview,1,18,episode,NTV (JP),1588743210,1588744822,1612,5/6/20 1:33,5/6/20 2:00
10980,Can't Win x and x Can't Lose,Season 1,Hunter x Hunter (2011),Hunter x Hunter (2011) - Can't Win x and x Can't Lose,1,19,episode,NTV (JP),1588818403,1588819464,1061,5/6/20 22:26,5/6/20 22:44
10981,Baffling x Turn of x Events,Season 1,Hunter x Hunter (2011),Hunter x Hunter (2011) - Baffling x Turn of x Events,1,20,episode,NTV (JP),1588819797,1588821052,1255,5/6/20 22:49,5/6/20 23:10
10982,Some x Brother x Trouble,Season 1,Hunter x Hunter (2011),Hunter x Hunter (2011) - Some x Brother x Trouble,1,21,episode,NTV (JP),1588821054,1588822367,1313,5/6/20 23:10,5/6/20 23:32
10983,A x Dangerous x Watchdog,Season 1,Hunter x Hunter (2011),Hunter x Hunter (2011) - A x Dangerous x Watchdog,1,22,episode,NTV (JP),1588822369,1588823663,1294,5/6/20 23:32,5/6/20 23:54
10984,The x Guard's x Duty!,Season 1,Hunter x Hunter (2011),Hunter x Hunter (2011) - The x Guard's x Duty!,1,23,episode,Madhouse,1588824020,1588824438,418,5/7/20 0:00,5/7/20 0:07
10985,The x Zoldyck x Family,Season 1,Hunter x Hunter (2011),Hunter x Hunter (2011) - The x Zoldyck x Family,1,24,episode,NTV (JP),1588825476,1588826838,1362,5/7/20 0:24,5/7/20 0:47
10986,Can't See x if x You're Blind,Season 1,Hunter x Hunter (2011),Hunter x Hunter (2011) - Can't See x if x You're Blind,1,25,episode,NTV (JP),1588826840,1588828232,1392,5/7/20 0:47,5/7/20 1:10
10987,Then x And x After,Season 1,Hunter x Hunter (2011),Hunter x Hunter (2011) - Then x And x After,1,26,episode,NTV (JP),1588828234,1588828530,296,5/7/20 1:10,5/7/20 1:15
10988,Arrival x At The x Arena!,Season 1,Hunter x Hunter (2011),Hunter x Hunter (2011) - Arrival x At The x Arena!,1,27,episode,Madhouse,1588993230,1588993583,353,5/8/20 23:00,5/8/20 23:06
10989,Nen x and x Nen,Season 1,Hunter x Hunter (2011),Hunter x Hunter (2011) - Nen x and x Nen,1,28,episode,NTV (JP),1588994790,1588996247,1457,5/8/20 23:26,5/8/20 23:50
10990,Awakening x And x Potential,Season 1,Hunter x Hunter (2011),Hunter x Hunter (2011) - Awakening x And x Potential,1,29,episode,NTV (JP),1589083089,1589084377,1288,5/9/20 23:58,5/10/20 0:19
10991,Fierce x and x Ferocious,Season 1,Hunter x Hunter (2011),Hunter x Hunter (2011) - Fierce x and x Ferocious,1,30,episode,Madhouse,1589084381,1589085627,1246,5/10/20 0:19,5/10/20 0:40
10992,Destiny x and x Tenacity,Season 1,Hunter x Hunter (2011),Hunter x Hunter (2011) - Destiny x and x Tenacity,1,31,episode,NTV (JP),1589343546,1589344869,1323,5/13/20 0:19,5/13/20 0:41
10993,A x Surprising x Win,Season 1,Hunter x Hunter (2011),Hunter x Hunter (2011) - A x Surprising x Win,1,32,episode,NTV (JP),1589416299,1589417579,1280,5/13/20 20:31,5/13/20 20:52
10994,An x Empty x Threat,Season 1,Hunter x Hunter (2011),Hunter x Hunter (2011) - An x Empty x Threat,1,33,episode,NTV (JP),1589417700,1589419090,1390,5/13/20 20:55,5/13/20 21:18
10995,Power x To x Avenge ,Season 1,Hunter x Hunter (2011),Hunter x Hunter (2011) - Power x To x Avenge ,1,34,episode,NTV (JP),1589419090,1589420343,1253,5/13/20 21:18,5/13/20 21:39
10996,The x True x Pass,Season 1,Hunter x Hunter (2011),Hunter x Hunter (2011) - The x True x Pass,1,35,episode,NTV (JP),1589420455,1589420909,454,5/13/20 21:40,5/13/20 21:48
10997,A Big Debt x And x A Small Kick,Season 1,Hunter x Hunter (2011),Hunter x Hunter (2011) - A Big Debt x And x A Small Kick,1,36,episode,NTV (JP),1589421840,1589423230,1390,5/13/20 22:04,5/13/20 22:27
10998,Ging x And x Gon,Season 1,Hunter x Hunter (2011),Hunter x Hunter (2011) - Ging x And x Gon,1,37,episode,NTV (JP),1590008160,1590009592,1432,5/20/20 16:56,5/20/20 17:19
10999,Reply x From x Dad,Season 1,Hunter x Hunter (2011),Hunter x Hunter (2011) - Reply x From x Dad,1,38,episode,NTV (JP),1590009705,1590009980,275,5/20/20 17:21,5/20/20 17:26
11000,Wish x And x Promise,Season 1,Hunter x Hunter (2011),Hunter x Hunter (2011) - Wish x And x Promise,1,39,episode,NTV (JP),1590426617,1590427999,1382,5/25/20 13:10,5/25/20 13:33
11001,Nen x Users x Unite?,Season 1,Hunter x Hunter (2011),Hunter x Hunter (2011) - Nen x Users x Unite?,1,40,episode,NTV (JP),1590427999,1590428398,399,5/25/20 13:33,5/25/20 13:39
11002,Gathering x Of x Heroes,Season 1,Hunter x Hunter (2011),Hunter x Hunter (2011) - Gathering x Of x Heroes,1,41,episode,NTV (JP),1590638289,1590639797,1508,5/27/20 23:58,5/28/20 0:23
11003,Defend x and x Attack,Season 1,Hunter x Hunter (2011),Hunter x Hunter (2011) - Defend x and x Attack,1,42,episode,NTV (JP),1593144524,1593145529,1005,6/26/20 0:08,6/26/20 0:25
11004,A x Shocking x Tragedy,Season 1,Hunter x Hunter (2011),Hunter x Hunter (2011) - A x Shocking x Tragedy,1,43,episode,NTV (JP),1593232290,1593234020,1730,6/27/20 0:31,6/27/20 1:00
11005,Buildup x To A x Fierce Battle,Season 1,Hunter x Hunter (2011),Hunter x Hunter (2011) - Buildup x To A x Fierce Battle,1,44,episode,NTV (JP),1593234024,1593235755,1731,6/27/20 1:00,6/27/20 1:29
11006,Restraint x And x Vow,Season 1,Hunter x Hunter (2011),Hunter x Hunter (2011) - Restraint x And x Vow,1,45,episode,NTV (JP),1593235825,1593236369,544,6/27/20 1:30,6/27/20 1:39
11007,Chasing x and x Waiting,Season 1,Hunter x Hunter (2011),Hunter x Hunter (2011) - Chasing x and x Waiting,1,46,episode,NTV (JP),1593270110,1593270858,748,6/27/20 11:01,6/27/20 11:14
11008,Condition x and x Condition,Season 1,Hunter x Hunter (2011),Hunter x Hunter (2011) - Condition x and x Condition,1,47,episode,NTV (JP),1593303765,1593305009,1244,6/27/20 20:22,6/27/20 20:43
11009,Very x Sharp x Eye,Season 1,Hunter x Hunter (2011),Hunter x Hunter (2011) - Very x Sharp x Eye,1,48,episode,NTV (JP),1593308189,1593308585,396,6/27/20 21:36,6/27/20 21:43
11010,Pursuit x and x Analysis,Season 1,Hunter x Hunter (2011),Hunter x Hunter (2011) - Pursuit x and x Analysis,1,49,episode,NTV (JP),1593309461,1593311229,1768,6/27/20 21:57,6/27/20 22:27
11011,Ally x and x Sword,Season 1,Hunter x Hunter (2011),Hunter x Hunter (2011) - Ally x and x Sword,1,50,episode,NTV (JP),1593311231,1593312567,1336,6/27/20 22:27,6/27/20 22:49
11012,A x Brutal x Battlefield,Season 1,Hunter x Hunter (2011),Hunter x Hunter (2011) - A x Brutal x Battlefield,1,51,episode,NTV (JP),1593312585,1593313917,1332,6/27/20 22:49,6/27/20 23:11
11013,Assault x And x Impact,Season 1,Hunter x Hunter (2011),Hunter x Hunter (2011) - Assault x And x Impact,1,52,episode,NTV (JP),1593463191,1593465367,2176,6/29/20 16:39,6/29/20 17:16
11014,Fake x And x Psyche,Season 1,Hunter x Hunter (2011),Hunter x Hunter (2011) - Fake x And x Psyche,1,53,episode,NTV (JP),1593467126,1593467530,404,6/29/20 17:45,6/29/20 17:52
11015,Fortunes x Aren't x Right?,Season 1,Hunter x Hunter (2011),Hunter x Hunter (2011) - Fortunes x Aren't x Right?,1,54,episode,NTV (JP),1593469204,1593471930,2726,6/29/20 18:20,6/29/20 19:05
11016,Allies x And x Lies,Season 1,Hunter x Hunter (2011),Hunter x Hunter (2011) - Allies x And x Lies,1,55,episode,NTV (JP),1593471931,1593474479,2548,6/29/20 19:05,6/29/20 19:47
11017,Beloved x And x Beleaguered,Season 1,Hunter x Hunter (2011),Hunter x Hunter (2011) - Beloved x And x Beleaguered,1,56,episode,NTV (JP),1593474481,1593478743,4262,6/29/20 19:48,6/29/20 20:59
11018,Initiative x And x Law,Season 1,Hunter x Hunter (2011),Hunter x Hunter (2011) - Initiative x And x Law,1,57,episode,NTV (JP),1593726398,1593727785,1387,7/2/20 17:46,7/2/20 18:09
11019,Signal x To x Retreat,Season 1,Hunter x Hunter (2011),Hunter x Hunter (2011) - Signal x To x Retreat,1,58,episode,NTV (JP),1593727790,1593729190,1400,7/2/20 18:09,7/2/20 18:33
10883,Bid x And x Haste,Season 2,Hunter x Hunter (2011),Hunter x Hunter (2011) - Bid x And x Haste,1,59,episode,NTV (JP),1594165099,1594166544,1445,7/7/20 19:38,7/7/20 20:02
10884,End x And x Beginning,Season 2,Hunter x Hunter (2011),Hunter x Hunter (2011) - End x And x Beginning,1,60,episode,NTV (JP),1594166547,1594168255,1708,7/7/20 20:02,7/7/20 20:30
10885,Invitation x And x Friend,Season 2,Hunter x Hunter (2011),Hunter x Hunter (2011) - Invitation x And x Friend,1,61,episode,NTV (JP),1594168258,1594169173,915,7/7/20 20:30,7/7/20 20:46
10886,Reality x And x Raw,Season 2,Hunter x Hunter (2011),Hunter x Hunter (2011) - Reality x And x Raw,1,62,episode,NTV (JP),1594323834,1594325090,1256,7/9/20 15:43,7/9/20 16:04
10887,A x Hard x Master,Season 2,Hunter x Hunter (2011),Hunter x Hunter (2011) - A x Hard x Master,1,63,episode,NTV (JP),1594325092,1594326418,1326,7/9/20 16:04,7/9/20 16:26
10888,Strengthen x And x Threaten,Season 2,Hunter x Hunter (2011),Hunter x Hunter (2011) - Strengthen x And x Threaten,1,64,episode,NTV (JP),1594326422,1594328384,1962,7/9/20 16:27,7/9/20 16:59
10889,Evil Fist x And x Rock-Paper-Scissors,Season 2,Hunter x Hunter (2011),Hunter x Hunter (2011) - Evil Fist x And x Rock-Paper-Scissors,1,65,episode,NTV (JP),1594328387,1594330052,1665,7/9/20 16:59,7/9/20 17:27
10890,Strategy x And x Scheme,Season 2,Hunter x Hunter (2011),Hunter x Hunter (2011) - Strategy x And x Scheme,1,66,episode,NTV (JP),1594508098,1594508399,301,7/11/20 18:54,7/11/20 18:59
10891,15 x 15,Season 2,Hunter x Hunter (2011),Hunter x Hunter (2011) - 15 x 15,1,67,episode,NTV (JP),1594521986,1594522263,277,7/11/20 22:46,7/11/20 22:51
10892,Pirates x And x Guesses,Season 2,Hunter x Hunter (2011),Hunter x Hunter (2011) - Pirates x And x Guesses,1,68,episode,NTV (JP),1594583041,1594584641,1600,7/12/20 15:44,7/12/20 16:10
10893,A x Heated x Showdown,Season 2,Hunter x Hunter (2011),Hunter x Hunter (2011) - A x Heated x Showdown,1,69,episode,NTV (JP),1594595125,1594596437,1312,7/12/20 19:05,7/12/20 19:27
10894,Guts x And x Courage,Season 2,Hunter x Hunter (2011),Hunter x Hunter (2011) - Guts x And x Courage,1,70,episode,NTV (JP),1594596437,1594596805,368,7/12/20 19:27,7/12/20 19:33
10895,Bargain x And x Deal,Season 2,Hunter x Hunter (2011),Hunter x Hunter (2011) - Bargain x And x Deal,1,71,episode,NTV (JP),1594785593,1594786387,794,7/14/20 23:59,7/15/20 0:13
10896,Chase x And x Chance,Season 2,Hunter x Hunter (2011),Hunter x Hunter (2011) - Chase x And x Chance,1,72,episode,NTV (JP),1595052013,1595052734,721,7/18/20 2:00,7/18/20 2:12
10897,Insanity x And x Sanity,Season 2,Hunter x Hunter (2011),Hunter x Hunter (2011) - Insanity x And x Sanity,1,73,episode,NTV (JP),1595107554,1595109001,1447,7/18/20 17:25,7/18/20 17:50
10898,Victor x And x Loser,Season 2,Hunter x Hunter (2011),Hunter x Hunter (2011) - Victor x And x Loser,1,74,episode,NTV (JP),1595109003,1595110579,1576,7/18/20 17:50,7/18/20 18:16
10899,Ging's Friends x And x True Friends,Season 2,Hunter x Hunter (2011),Hunter x Hunter (2011) - Ging's Friends x And x True Friends,1,75,episode,NTV (JP),1595110583,1595111195,612,7/18/20 18:16,7/18/20 18:26
10900,Reunion x And x Understanding,Season 2,Hunter x Hunter (2011),Hunter x Hunter (2011) - Reunion x And x Understanding,1,76,episode,NTV (JP),1595782556,1595783902,1346,7/26/20 12:55,7/26/20 13:18
10901,Unease x And x Sighting,Season 2,Hunter x Hunter (2011),Hunter x Hunter (2011) - Unease x And x Sighting,1,77,episode,NTV (JP),1595783905,1595784048,143,7/26/20 13:18,7/26/20 13:20
10902,Very x Rapid x Reproduction,Season 2,Hunter x Hunter (2011),Hunter x Hunter (2011) - Very x Rapid x Reproduction,1,78,episode,NTV (JP),1595803512,1595805114,1602,7/26/20 18:45,7/26/20 19:11
10903,No x Good x NGL,Season 2,Hunter x Hunter (2011),Hunter x Hunter (2011) - No x Good x NGL,1,79,episode,NTV (JP),1595805202,1595806860,1658,7/26/20 19:13,7/26/20 19:41
10904,Evil x And x Terrible,Season 2,Hunter x Hunter (2011),Hunter x Hunter (2011) - Evil x And x Terrible,1,80,episode,NTV (JP),1595806878,1595808977,2099,7/26/20 19:41,7/26/20 20:16
10905,The x Fight x Begins,Season 2,Hunter x Hunter (2011),Hunter x Hunter (2011) - The x Fight x Begins,1,81,episode,NTV (JP),1595808982,1595811137,2155,7/26/20 20:16,7/26/20 20:52
10906,Kite x And x Slots,Season 2,Hunter x Hunter (2011),Hunter x Hunter (2011) - Kite x And x Slots,1,82,episode,NTV (JP),1595811162,1595812588,1426,7/26/20 20:52,7/26/20 21:16
10907,Inspiration x To x Evolve,Season 2,Hunter x Hunter (2011),Hunter x Hunter (2011) - Inspiration x To x Evolve,1,83,episode,NTV (JP),1595812598,1595813903,1305,7/26/20 21:16,7/26/20 21:38
10908,A x Fated x Awakening,Season 2,Hunter x Hunter (2011),Hunter x Hunter (2011) - A x Fated x Awakening,1,84,episode,NTV (JP),1595813951,1595815488,1537,7/26/20 21:39,7/26/20 22:04
10909,Light x And x Darkness,Season 2,Hunter x Hunter (2011),Hunter x Hunter (2011) - Light x And x Darkness,1,85,episode,NTV (JP),1595816484,1595818004,1520,7/26/20 22:21,7/26/20 22:46
10910,Promise x And x Reunion,Season 2,Hunter x Hunter (2011),Hunter x Hunter (2011) - Promise x And x Reunion,1,86,episode,NTV (JP),1595818027,1595820018,1991,7/26/20 22:47,7/26/20 23:20
10911,Duel x And x Escape,Season 2,Hunter x Hunter (2011),Hunter x Hunter (2011) - Duel x And x Escape,1,87,episode,NTV (JP),1595820842,1595822180,1338,7/26/20 23:34,7/26/20 23:56
10912,Rock-Paper-Scissors x And x Weakness,Season 2,Hunter x Hunter (2011),Hunter x Hunter (2011) - Rock-Paper-Scissors x And x Weakness,1,88,episode,NTV (JP),1595823387,1595878282,54895,7/27/20 0:16,7/27/20 15:31
10913,Compassion x And x Strength,Season 2,Hunter x Hunter (2011),Hunter x Hunter (2011) - Compassion x And x Strength,1,89,episode,NTV (JP),1595897948,1595899386,1438,7/27/20 20:59,7/27/20 21:23
10914,Interest x And x Curse,Season 2,Hunter x Hunter (2011),Hunter x Hunter (2011) - Interest x And x Curse,1,90,episode,NTV (JP),1595974174,1595975943,1769,7/28/20 18:09,7/28/20 18:39
10915,The Strong x And x The Weak,Season 2,Hunter x Hunter (2011),Hunter x Hunter (2011) - The Strong x And x The Weak,1,91,episode,NTV (JP),1595975950,1595977707,1757,7/28/20 18:39,7/28/20 19:08
10916,One Wish x And x Two Promises,Season 2,Hunter x Hunter (2011),Hunter x Hunter (2011) - One Wish x And x Two Promises,1,92,episode,NTV (JP),1595977712,1595979154,1442,7/28/20 19:08,7/28/20 19:32
10917,Date x With x Palm,Season 2,Hunter x Hunter (2011),Hunter x Hunter (2011) - Date x With x Palm,1,93,episode,NTV (JP),1595979157,1595980540,1383,7/28/20 19:32,7/28/20 19:55
10918,Friend x And x Journey,Season 2,Hunter x Hunter (2011),Hunter x Hunter (2011) - Friend x And x Journey,1,94,episode,NTV (JP),1596258509,1596259895,1386,8/1/20 1:08,8/1/20 1:31
10919,Grudge x And x Dread,Season 2,Hunter x Hunter (2011),Hunter x Hunter (2011) - Grudge x And x Dread,1,95,episode,NTV (JP),1596259898,1596261230,1332,8/1/20 1:31,8/1/20 1:53
10920,A x Lawless x Home,Season 2,Hunter x Hunter (2011),Hunter x Hunter (2011) - A x Lawless x Home,1,96,episode,NTV (JP),1596261376,1596262522,1146,8/1/20 1:56,8/1/20 2:15
10921,Carnage x And x Devastation,Season 2,Hunter x Hunter (2011),Hunter x Hunter (2011) - Carnage x And x Devastation,1,97,episode,NTV (JP),1596263187,1596263510,323,8/1/20 2:26,8/1/20 2:31
10922,Infiltration x And x Selection,Season 2,Hunter x Hunter (2011),Hunter x Hunter (2011) - Infiltration x And x Selection,1,98,episode,NTV (JP),1596952328,1596953613,1285,8/9/20 1:52,8/9/20 2:13
10923,Combination x And x Evolution,Season 2,Hunter x Hunter (2011),Hunter x Hunter (2011) - Combination x And x Evolution,1,99,episode,NTV (JP),1596987311,1596988431,1120,8/9/20 11:35,8/9/20 11:53
10924,Tracking x And x Pursuit ,Season 2,Hunter x Hunter (2011),Hunter x Hunter (2011) - Tracking x And x Pursuit ,1,100,episode,NTV (JP),1596998713,1597000207,1494,8/9/20 14:45,8/9/20 15:10
10925,Ikalgo x And x Lightning,Season 2,Hunter x Hunter (2011),Hunter x Hunter (2011) - Ikalgo x And x Lightning,1,101,episode,NTV (JP),1597000207,1597001280,1073,8/9/20 15:10,8/9/20 15:28
10926,Power x And x Games,Season 2,Hunter x Hunter (2011),Hunter x Hunter (2011) - Power x And x Games,1,102,episode,NTV (JP),1597001811,1597003462,1651,8/9/20 15:36,8/9/20 16:04
10927,Check x And x Mate,Season 2,Hunter x Hunter (2011),Hunter x Hunter (2011) - Check x And x Mate,1,103,episode,NTV (JP),1597008687,1597010369,1682,8/9/20 17:31,8/9/20 17:59
10928,Doubt x And x Hesitation,Season 2,Hunter x Hunter (2011),Hunter x Hunter (2011) - Doubt x And x Hesitation,1,104,episode,NTV (JP),1597010379,1597011982,1603,8/9/20 17:59,8/9/20 18:26
10929,Resolve x And x Awakening,Season 2,Hunter x Hunter (2011),Hunter x Hunter (2011) - Resolve x And x Awakening,1,105,episode,NTV (JP),1597029212,1597031141,1929,8/9/20 23:13,8/9/20 23:45
10930,Knov x And x Morel,Season 2,Hunter x Hunter (2011),Hunter x Hunter (2011) - Knov x And x Morel,1,106,episode,NTV (JP),1597031144,1597032579,1435,8/9/20 23:45,8/10/20 0:09
10931,Return x And x Retire,Season 2,Hunter x Hunter (2011),Hunter x Hunter (2011) - Return x And x Retire,1,107,episode,NTV (JP),1597092513,1597094263,1750,8/10/20 16:48,8/10/20 17:17
10932,Gungi x Of x Komugi,Season 2,Hunter x Hunter (2011),Hunter x Hunter (2011) - Gungi x Of x Komugi,1,108,episode,NTV (JP),1597113775,1597115669,1894,8/10/20 22:42,8/10/20 23:14
10933,Taking Stock x And x Taking Action,Season 2,Hunter x Hunter (2011),Hunter x Hunter (2011) - Taking Stock x And x Taking Action,1,109,episode,NTV (JP),1597115714,1597115867,153,8/10/20 23:15,8/10/20 23:17
10934,Confusion x And x Expectation,Season 2,Hunter x Hunter (2011),Hunter x Hunter (2011) - Confusion x And x Expectation,1,110,episode,NTV (JP),1597266552,1597267434,882,8/12/20 17:09,8/12/20 17:23
10935,Charge x And x Invade,Season 2,Hunter x Hunter (2011),Hunter x Hunter (2011) - Charge x And x Invade,1,111,episode,NTV (JP),1597268024,1597269027,1003,8/12/20 17:33,8/12/20 17:50
10936,Monster x And x Monster,Season 2,Hunter x Hunter (2011),Hunter x Hunter (2011) - Monster x And x Monster,1,112,episode,NTV (JP),1597269457,1597270816,1359,8/12/20 17:57,8/12/20 18:20
10937,An x Indebted x Insect,Season 2,Hunter x Hunter (2011),Hunter x Hunter (2011) - An x Indebted x Insect,1,113,episode,NTV (JP),1597270819,1597271917,1098,8/12/20 18:20,8/12/20 18:38
10938,Divide x And x Conquer,Season 2,Hunter x Hunter (2011),Hunter x Hunter (2011) - Divide x And x Conquer,1,114,episode,NTV (JP),1597272261,1597273989,1728,8/12/20 18:44,8/12/20 19:13
10939,Duty x and x Question,Season 2,Hunter x Hunter (2011),Hunter x Hunter (2011) - Duty x and x Question,1,115,episode,NTV (JP),1597273992,1597275731,1739,8/12/20 19:13,8/12/20 19:42
10940,Revenge x And x Recovery,Season 2,Hunter x Hunter (2011),Hunter x Hunter (2011) - Revenge x And x Recovery,1,116,episode,NTV (JP),1597367105,1597367520,415,8/13/20 21:05,8/13/20 21:12
10941,Insult x And x Payback,Season 2,Hunter x Hunter (2011),Hunter x Hunter (2011) - Insult x And x Payback,1,117,episode,NTV (JP),1597369145,1597370312,1167,8/13/20 21:39,8/13/20 21:58
10942,A x False x Rage ,Season 2,Hunter x Hunter (2011),Hunter x Hunter (2011) - A x False x Rage ,1,118,episode,NTV (JP),1597545304,1597546894,1590,8/15/20 22:35,8/15/20 23:01
10943,Strong x Or x Weak,Season 2,Hunter x Hunter (2011),Hunter x Hunter (2011) - Strong x Or x Weak,1,119,episode,NTV (JP),1597546897,1597547778,881,8/15/20 23:01,8/15/20 23:16
10944,Fake x And x Real,Season 2,Hunter x Hunter (2011),Hunter x Hunter (2011) - Fake x And x Real,1,120,episode,NTV (JP),1597640407,1597641719,1312,8/17/20 1:00,8/17/20 1:21
10945,Defeat x And x Dignity,Season 2,Hunter x Hunter (2011),Hunter x Hunter (2011) - Defeat x And x Dignity,1,121,episode,NTV (JP),1597900542,1597902636,2094,8/20/20 1:15,8/20/20 1:50
10946,Pose x And x Name,Season 2,Hunter x Hunter (2011),Hunter x Hunter (2011) - Pose x And x Name,1,122,episode,NTV (JP),1598134231,1598135816,1585,8/22/20 18:10,8/22/20 18:36
10947,Centipede x And x Memory,Season 2,Hunter x Hunter (2011),Hunter x Hunter (2011) - Centipede x And x Memory,1,123,episode,NTV (JP),1598135832,1598137135,1303,8/22/20 18:37,8/22/20 18:58
10948,Breakdown x And x Awakening,Season 2,Hunter x Hunter (2011),Hunter x Hunter (2011) - Breakdown x And x Awakening,1,124,episode,NTV (JP),1598137138,1598144729,7591,8/22/20 18:58,8/22/20 21:05
10949,Great Power x And x Ultimate Power,Season 2,Hunter x Hunter (2011),Hunter x Hunter (2011) - Great Power x And x Ultimate Power,1,125,episode,NTV (JP),1598229561,1598230981,1420,8/23/20 20:39,8/23/20 21:03
10950,Zero x And x Rose,Season 2,Hunter x Hunter (2011),Hunter x Hunter (2011) - Zero x And x Rose,1,126,episode,NTV (JP),1598232558,1598234244,1686,8/23/20 21:29,8/23/20 21:57
10951,Hostility x And x Determination,Season 2,Hunter x Hunter (2011),Hunter x Hunter (2011) - Hostility x And x Determination,1,127,episode,NTV (JP),1598835192,1598836843,1651,8/30/20 20:53,8/30/20 21:20
10952,Unparalleled Joy x And x Unconditional Love,Season 2,Hunter x Hunter (2011),Hunter x Hunter (2011) - Unparalleled Joy x And x Unconditional Love,1,128,episode,NTV (JP),1598836846,1598838292,1446,8/30/20 21:20,8/30/20 21:44
10953,Formidable Enemy x And x Clear Objective,Season 2,Hunter x Hunter (2011),Hunter x Hunter (2011) - Formidable Enemy x And x Clear Objective,1,129,episode,NTV (JP),1598838294,1598838675,381,8/30/20 21:44,8/30/20 21:51
10954,Magic x to x Destroy,Season 2,Hunter x Hunter (2011),Hunter x Hunter (2011) - Magic x to x Destroy,1,130,episode,NTV (JP),1598848665,1598849050,385,8/31/20 0:37,8/31/20 0:44
10955,Anger x And x Light,Season 2,Hunter x Hunter (2011),Hunter x Hunter (2011) - Anger x And x Light,1,131,episode,NTV (JP),1598918806,1598920196,1390,8/31/20 20:06,8/31/20 20:29
10956,Flash x And x Start,Season 2,Hunter x Hunter (2011),Hunter x Hunter (2011) - Flash x And x Start,1,132,episode,NTV (JP),1598920199,1598921800,1601,8/31/20 20:29,8/31/20 20:56
10957,Deadline x To x Live,Season 2,Hunter x Hunter (2011),Hunter x Hunter (2011) - Deadline x To x Live,1,133,episode,NTV (JP),1598978172,1598979371,1199,9/1/20 12:36,9/1/20 12:56
10958,The Word x Is x You,Season 2,Hunter x Hunter (2011),Hunter x Hunter (2011) - The Word x Is x You,1,134,episode,NTV (JP),1599019562,1599021545,1983,9/2/20 0:06,9/2/20 0:39
10959,This Person x And x This Moment,Season 2,Hunter x Hunter (2011),Hunter x Hunter (2011) - This Person x And x This Moment,1,135,episode,NTV (JP),1599069352,1599070875,1523,9/2/20 13:55,9/2/20 14:21
10960,Homecoming x And x Real Name,Season 2,Hunter x Hunter (2011),Hunter x Hunter (2011) - Homecoming x And x Real Name,1,136,episode,NTV (JP),1599071201,1599072812,1611,9/2/20 14:26,9/2/20 14:53
16060,Debate x Among x Zodiacs,Season 1,Hunter x Hunter (2011),Hunter x Hunter (2011) - Debate x Among x Zodiacs,1,137,episode,NTV (JP),1599099776,1599101383,1607,9/2/20 22:22,9/2/20 22:49
